{
  "schemaVersion": 1,
  "id": "ghost-warm",
  "name": "Ghost-like warm editorial UI",
  "description": "A warm editorial publishing surface captured across a marketing page and the writer-facing admin of one product: near-black warm ink on an off-white paper background, sand-tinted panels, an evergreen brand fill, a reading type scale that is deliberately larger than the control type scale, and one red reserved for validation errors.",
  "captures": [
    {
      "schemaVersion": 1,
      "id": "ghost-btn-primary",
      "componentType": "button",
      "sourceUrl": "https://ghost.org/pricing/",
      "capturedAt": "2026-04-08T09:12:03.000Z",
      "screenshot": null,
      "styles": {
        "color": "#ffffff",
        "fontFamily": "\"Untitled Sans\", -apple-system, BlinkMacSystemFont, \"Segoe UI\", Helvetica, Arial, sans-serif",
        "fontSize": "15px",
        "fontWeight": "500",
        "lineHeight": "20px",
        "backgroundColor": "#0f7a5a",
        "paddingTop": "8px",
        "paddingRight": "16px",
        "paddingBottom": "8px",
        "paddingLeft": "16px",
        "marginTop": "0px",
        "marginRight": "0px",
        "marginBottom": "0px",
        "marginLeft": "0px",
        "borderTopWidth": "0px",
        "borderRightWidth": "0px",
        "borderBottomWidth": "0px",
        "borderLeftWidth": "0px",
        "borderStyle": "none",
        "borderTopLeftRadius": "6px",
        "borderTopRightRadius": "6px",
        "borderBottomRightRadius": "6px",
        "borderBottomLeftRadius": "6px",
        "boxShadow": "0px 1px 2px 0px rgba(28, 25, 23, 0.05)"
      },
      "notes": "Start a free trial button in the pricing hero."
    },
    {
      "schemaVersion": 1,
      "id": "ghost-btn-secondary",
      "componentType": "button",
      "sourceUrl": "https://ghost.org/pricing/",
      "capturedAt": "2026-04-08T09:12:21.000Z",
      "screenshot": null,
      "styles": {
        "color": "#1a1917",
        "fontFamily": "\"Untitled Sans\", -apple-system, BlinkMacSystemFont, \"Segoe UI\", Helvetica, Arial, sans-serif",
        "fontSize": "15px",
        "fontWeight": "500",
        "lineHeight": "20px",
        "backgroundColor": "#faf9f6",
        "paddingTop": "8px",
        "paddingRight": "16px",
        "paddingBottom": "8px",
        "paddingLeft": "16px",
        "marginTop": "0px",
        "marginRight": "0px",
        "marginBottom": "0px",
        "marginLeft": "8px",
        "borderTopWidth": "1px",
        "borderRightWidth": "1px",
        "borderBottomWidth": "1px",
        "borderLeftWidth": "1px",
        "borderStyle": "solid",
        "borderColor": "#e5e0d6",
        "borderTopLeftRadius": "6px",
        "borderTopRightRadius": "6px",
        "borderBottomRightRadius": "6px",
        "borderBottomLeftRadius": "6px",
        "boxShadow": "none"
      },
      "notes": "See how it works button beside the primary CTA."
    },
    {
      "schemaVersion": 1,
      "id": "ghost-input-email",
      "componentType": "input",
      "sourceUrl": "https://ghost.org/pricing/",
      "capturedAt": "2026-04-08T09:13:44.000Z",
      "screenshot": null,
      "styles": {
        "color": "#1a1917",
        "fontFamily": "\"Untitled Sans\", -apple-system, BlinkMacSystemFont, \"Segoe UI\", Helvetica, Arial, sans-serif",
        "fontSize": "15px",
        "fontWeight": "400",
        "lineHeight": "20px",
        "backgroundColor": "#faf9f6",
        "paddingTop": "10px",
        "paddingRight": "12px",
        "paddingBottom": "10px",
        "paddingLeft": "12px",
        "marginTop": "0px",
        "marginRight": "0px",
        "marginBottom": "6px",
        "marginLeft": "0px",
        "borderTopWidth": "1px",
        "borderRightWidth": "1px",
        "borderBottomWidth": "1px",
        "borderLeftWidth": "1px",
        "borderStyle": "solid",
        "borderColor": "#e5e0d6",
        "borderTopLeftRadius": "6px",
        "borderTopRightRadius": "6px",
        "borderBottomRightRadius": "6px",
        "borderBottomLeftRadius": "6px",
        "boxShadow": "none"
      },
      "notes": "Email field in the newsletter sign-up block. 10px vertical padding is an optical adjustment, not a scale step."
    },
    {
      "schemaVersion": 1,
      "id": "ghost-input-search",
      "componentType": "input",
      "sourceUrl": "https://demo.ghost.io/ghost/posts",
      "capturedAt": "2026-04-08T09:21:07.000Z",
      "screenshot": null,
      "styles": {
        "color": "#1a1917",
        "fontFamily": "\"Untitled Sans\", -apple-system, BlinkMacSystemFont, \"Segoe UI\", Helvetica, Arial, sans-serif",
        "fontSize": "15px",
        "fontWeight": "400",
        "lineHeight": "20px",
        "backgroundColor": "#faf9f6",
        "paddingTop": "8px",
        "paddingRight": "12px",
        "paddingBottom": "8px",
        "paddingLeft": "12px",
        "marginTop": "0px",
        "marginRight": "0px",
        "marginBottom": "0px",
        "marginLeft": "0px",
        "borderTopWidth": "1px",
        "borderRightWidth": "1px",
        "borderBottomWidth": "1px",
        "borderLeftWidth": "1px",
        "borderStyle": "solid",
        "borderColor": "#e3ded4",
        "borderTopLeftRadius": "6px",
        "borderTopRightRadius": "6px",
        "borderBottomRightRadius": "6px",
        "borderBottomLeftRadius": "6px",
        "boxShadow": "none"
      },
      "notes": "Post search field in the admin list. Its border is a hair warmer than the marketing site's; the two are the same intent."
    },
    {
      "schemaVersion": 1,
      "id": "ghost-card-post",
      "componentType": "card",
      "sourceUrl": "https://demo.ghost.io/ghost/posts",
      "capturedAt": "2026-04-08T09:22:35.000Z",
      "screenshot": null,
      "styles": {
        "color": "#1a1917",
        "fontFamily": "\"Untitled Sans\", -apple-system, BlinkMacSystemFont, \"Segoe UI\", Helvetica, Arial, sans-serif",
        "fontSize": "17px",
        "fontWeight": "400",
        "lineHeight": "27px",
        "backgroundColor": "#f5f2ec",
        "paddingTop": "24px",
        "paddingRight": "24px",
        "paddingBottom": "24px",
        "paddingLeft": "24px",
        "marginTop": "0px",
        "marginRight": "0px",
        "marginBottom": "24px",
        "marginLeft": "0px",
        "gap": "12px",
        "borderTopWidth": "1px",
        "borderRightWidth": "1px",
        "borderBottomWidth": "1px",
        "borderLeftWidth": "1px",
        "borderStyle": "solid",
        "borderColor": "#e5e0d6",
        "borderTopLeftRadius": "12px",
        "borderTopRightRadius": "12px",
        "borderBottomRightRadius": "12px",
        "borderBottomLeftRadius": "12px",
        "boxShadow": "0px 4px 12px -2px rgba(28, 25, 23, 0.10), 0px 2px 4px -2px rgba(28, 25, 23, 0.06)"
      },
      "notes": "Post preview card in the admin list."
    },
    {
      "schemaVersion": 1,
      "id": "ghost-card-callout",
      "componentType": "card",
      "sourceUrl": "https://ghost.org/pricing/",
      "capturedAt": "2026-04-08T09:14:52.000Z",
      "screenshot": null,
      "styles": {
        "color": "#6b665d",
        "fontFamily": "\"Untitled Sans\", -apple-system, BlinkMacSystemFont, \"Segoe UI\", Helvetica, Arial, sans-serif",
        "fontSize": "17px",
        "fontWeight": "400",
        "lineHeight": "27px",
        "backgroundColor": "#f6f3ed",
        "paddingTop": "16px",
        "paddingRight": "20px",
        "paddingBottom": "16px",
        "paddingLeft": "20px",
        "marginTop": "0px",
        "marginRight": "0px",
        "marginBottom": "20px",
        "marginLeft": "0px",
        "gap": "12px",
        "borderTopWidth": "1px",
        "borderRightWidth": "1px",
        "borderBottomWidth": "1px",
        "borderLeftWidth": "1px",
        "borderStyle": "solid",
        "borderColor": "#e5e0d6",
        "borderTopLeftRadius": "12px",
        "borderTopRightRadius": "12px",
        "borderBottomRightRadius": "12px",
        "borderBottomLeftRadius": "12px",
        "boxShadow": "none"
      },
      "notes": "Aside explaining annual billing. Its sand is a shade off the admin card's; both read as the same paper."
    },
    {
      "schemaVersion": 1,
      "id": "ghost-type-page-title",
      "componentType": "typography",
      "sourceUrl": "https://ghost.org/pricing/",
      "capturedAt": "2026-04-08T09:15:30.000Z",
      "screenshot": null,
      "styles": {
        "color": "#1a1917",
        "fontFamily": "\"Untitled Sans\", -apple-system, BlinkMacSystemFont, \"Segoe UI\", Helvetica, Arial, sans-serif",
        "fontSize": "28px",
        "fontWeight": "600",
        "lineHeight": "34px",
        "letterSpacing": "-0.4px",
        "backgroundColor": "rgba(0, 0, 0, 0)",
        "paddingTop": "0px",
        "paddingRight": "0px",
        "paddingBottom": "0px",
        "paddingLeft": "0px",
        "marginTop": "0px",
        "marginRight": "0px",
        "marginBottom": "12px",
        "marginLeft": "0px",
        "borderTopWidth": "0px",
        "borderRightWidth": "0px",
        "borderBottomWidth": "0px",
        "borderLeftWidth": "0px",
        "borderStyle": "none",
        "borderTopLeftRadius": "0px",
        "borderTopRightRadius": "0px",
        "borderBottomRightRadius": "0px",
        "borderBottomLeftRadius": "0px",
        "boxShadow": "none"
      },
      "notes": "Pricing page headline."
    },
    {
      "schemaVersion": 1,
      "id": "ghost-type-section-heading",
      "componentType": "typography",
      "sourceUrl": "https://demo.ghost.io/ghost/posts",
      "capturedAt": "2026-04-08T09:23:18.000Z",
      "screenshot": null,
      "styles": {
        "color": "#1a1917",
        "fontFamily": "\"Untitled Sans\", -apple-system, BlinkMacSystemFont, \"Segoe UI\", Helvetica, Arial, sans-serif",
        "fontSize": "20px",
        "fontWeight": "600",
        "lineHeight": "28px",
        "letterSpacing": "-0.2px",
        "backgroundColor": "rgba(0, 0, 0, 0)",
        "paddingTop": "0px",